{
  "apiVersion": "sippycup.media-session/v1",
  "direction": "caller_to_callee",
  "codec": "PCMU",
  "digits": "12#",
  "echo": {
    "required": true,
    "timeoutMs": 500
  },
  "revisions": [
    {
      "activationMs": 0,
      "localSdp": "v=0\r\no=test 1 1 IN IP4 127.0.0.1\r\ns=before\r\nc=IN IP4 127.0.0.1\r\nt=0 0\r\nm=audio 20000 RTP/AVP 0 101\r\na=rtpmap:0 PCMU/8000\r\na=rtpmap:101 telephone-event/8000\r\na=fmtp:101 0-15\r\na=ptime:20\r\n",
      "remoteSdp": "v=0\r\no=test 1 1 IN IP4 127.0.0.1\r\ns=before\r\nc=IN IP4 127.0.0.1\r\nt=0 0\r\nm=audio 21000 RTP/AVP 0 101\r\na=rtpmap:0 PCMU/8000\r\na=rtpmap:101 telephone-event/8000\r\na=fmtp:101 0-15\r\na=ptime:20\r\n"
    },
    {
      "activationMs": 500,
      "localSdp": "v=0\r\no=test 1 2 IN IP4 127.0.0.1\r\ns=after\r\nc=IN IP4 127.0.0.1\r\nt=0 0\r\nm=audio 20002 RTP/AVP 96 110\r\na=rtpmap:96 PCMU/8000\r\na=rtpmap:110 telephone-event/8000\r\na=fmtp:110 0-15\r\na=ptime:20\r\n",
      "remoteSdp": "v=0\r\no=test 1 2 IN IP4 127.0.0.1\r\ns=after\r\nc=IN IP4 127.0.0.1\r\nt=0 0\r\nm=audio 21002 RTP/AVP 96 110\r\na=rtpmap:96 PCMU/8000\r\na=rtpmap:110 telephone-event/8000\r\na=fmtp:110 0-15\r\na=ptime:20\r\n"
    }
  ]
}
